<?xml version="1.0" encoding="UTF-8"?>
<xs:schema xmlns:xs="http://www.w3.org/2001/XMLSchema"
    targetNamespace="http://www.congreso.com/schema"
    xmlns:c="http://www.congreso.com/schema"
    elementFormDefault="qualified">
    <xs:element name="congreso">
        <xs:complexType>
            <xs:sequence>
                <xs:element name="ponentes">
                    <xs:complexType>
                        <xs:sequence>
                            <xs:element name="ponente" minOccurs="2" maxOccurs="unbounded">
                                <xs:complexType>
                                    <xs:sequence>
                                        <xs:element name="nombre" type="xs:string" />
                                        <xs:element name="organizacion" type="xs:string" />
                                    </xs:sequence>
                                    <xs:attribute name="id" use="required">
                                        <xs:simpleType>
                                            <xs:restriction base="xs:string">
                                                <xs:pattern value="P[0-9]{2}" />
                                            </xs:restriction>
                                        </xs:simpleType>
                                    </xs:attribute>
                                </xs:complexType>
                            </xs:element>
                        </xs:sequence>
                    </xs:complexType>
                </xs:element>
                <xs:element name="charlas">
                    <xs:complexType>
                        <xs:sequence>
                            <xs:element name="charla" minOccurs="3" maxOccurs="unbounded">
                                <xs:complexType>
                                    <xs:sequence>
                                        <xs:element name="titulo" type="xs:string" />
                                        <xs:element name="resumen" type="xs:string" />
                                        <xs:element name="sala" type="xs:string" />                                   
                                    </xs:sequence>
                                    <xs:attribute name="ponente_ref" type="xs:string" use="required"/>
                                </xs:complexType>
                            </xs:element>
                        </xs:sequence>
                    </xs:complexType>
                </xs:element>
            </xs:sequence>
        </xs:complexType>

        <xs:key name="ponente-key">
            <xs:selector xpath=".//c:ponente" />
            <xs:field xpath="@id" />
        </xs:key>

        <xs:keyref name="charla-ponente-ref" refer="c:ponente-key">
            <xs:selector xpath=".//c:charla" />
            <xs:field xpath="@ponente_ref" />
        </xs:keyref>

    </xs:element>
</xs:schema>